test_case_id,requirement_id,requirement_title,title,precondition,test_steps,test_data,expected_result,technique,priority,risk_score,coverage_items,modified_by_user
tc-st-b5e6d19a,LR-006,Both email and password empty,State transition path 1 (ALL_TRANSITIONS),System in state: Disabled,"State: Disabled
State: Disabled
State: Enabled
State: Disabled
State: Enabled
State: Enabled","fieldChange, fieldChange, fieldChange, fieldChange, fieldChange","The login form remains disabled when both fields are empty, and becomes enabled when at least one field is non-empty.",StateTransition,Low,6,"Disabled--fieldChange[bothEmpty]/remain disabled-->Disabled, Disabled--fieldChange[!bothEmpty]-->Enabled, Enabled--fieldChange[bothEmpty]/disable login-->Disabled, Enabled--fieldChange[!bothEmpty]-->Enabled",No
LR-006_EP_001,LR-006,Both email and password empty,Both fields empty - EP,Login page loaded,"Clear the username field
Clear the password field
Verify the login form state","{""username"": """", ""password"": """"}",Login form remains disabled,EP,Low,6,"CI_LR-006_field_username, CI_LR-006_field_password",No
LR-006_DT_001,LR-006,Both email and password empty,Both fields empty - DT,Login page loaded,"Leave the username field empty
Leave the password field empty
Verify the login form state","{""username"": """", ""password"": """"}",Login form remains disabled,DT,Low,6,CI_LR-006_condition_0,No
