test_case_id,requirement_id,requirement_title,title,precondition,test_steps,test_data,expected_result,technique,priority,risk_score,coverage_items,modified_by_user
LR-023_EP_001,LR-023,Password comparison is case-sensitive,EP: Exact case password - MD5 hash computed correctly,,"Input password as 'Password123'.
Retrieve the computed MD5 hash.
Verify that hash matches the precomputed MD5 for 'Password123'.",password: Password123,MD5 hash of 'Password123' is computed and matches the expected hash.,EP,High,20,CI_LR-023_field_password,No
LR-023_DT_001,LR-023,Password comparison is case-sensitive,DT: Password provided - compute MD5 on exact string,,"Input password as 'TestCase1'.
Observe that MD5 hash is computed.",password: TestCase1,System computes MD5 hash on 'TestCase1' and provides the hash.,DT,High,20,CI_LR-023_condition_0,No
tc-st-150c4561,LR-023,Password comparison is case-sensitive,State transition path 1 (ALL_TRANSITIONS),System in state: Idle,"State: Idle
State: Idle",compute_hash,The MD5 hash is computed successfully and the returned value is a 32-character hexadecimal string matching the expected hash of the input password.,StateTransition,High,20,Idle--compute_hash/Compute MD5 hash on exact password string-->Idle,No
