test_case_id,requirement_id,requirement_title,title,precondition,test_steps,test_data,expected_result,technique,priority,risk_score,coverage_items,modified_by_user,review_action,review_reason,manual_action,manual_reason,precondition_status,execution_note
LR-006_EP_001,LR-006,Both email and password empty,Both fields empty - EP,Juice Shop 运行于 http://localhost:3001；已加载默认种子数据（verified 2026-05-30）; Login page loaded,"Clear the username field
Clear the password field
Verify the login form state","{""username"": """", ""password"": """"}",Login form remains disabled,EP,Low,6,"CI_LR-006_field_username, CI_LR-006_field_password",Yes,KEPT,工具生成用例有效，仅标记审查通过,,,ui_only,浏览器 UI 测试；API 无法验证按钮禁用/Remember Me/Enter 键
LR-006_DT_001,LR-006,Both email and password empty,Both fields empty - DT,Juice Shop 运行于 http://localhost:3001；已加载默认种子数据（verified 2026-05-30）; Login page loaded,"Leave the username field empty
Leave the password field empty
Verify the login form state","{""username"": """", ""password"": """"}",Login button disabled; both fields invalid; no HTTP request,DT,Low,6,CI_LR-006_condition_0,Yes,PATCHED,补全 test_data / 修正 expected_result 以匹配 Juice Shop 需求,,,ui_only,浏览器 UI 测试；API 无法验证按钮禁用/Remember Me/Enter 键
tc-st-b5e6d19a,LR-006,Both email and password empty,State transition path 1 (ALL_TRANSITIONS),Juice Shop 运行于 http://localhost:3001；已加载默认种子数据（verified 2026-05-30）; System in state: Disabled,"State: Disabled
State: Disabled
State: Enabled
State: Disabled
State: Enabled
State: Enabled",email=; password=,"The login form remains disabled when both fields are empty, and becomes enabled when at least one field is non-empty.",StateTransition,Low,6,"Disabled--fieldChange[bothEmpty]/remain disabled-->Disabled, Disabled--fieldChange[!bothEmpty]-->Enabled, Enabled--fieldChange[bothEmpty]/disable login-->Disabled, Enabled--fieldChange[!bothEmpty]-->Enabled",Yes,PATCHED,补全 test_data / 修正 expected_result 以匹配 Juice Shop 需求,,,ui_only,浏览器 UI 测试；API 无法验证按钮禁用/Remember Me/Enter 键
