test_case_id,requirement_id,requirement_title,title,precondition,test_steps,test_data,expected_result,technique,priority,risk_score,coverage_items,modified_by_user,review_action,review_reason,manual_action,manual_reason,precondition_status,execution_note
LR-023_EP_001,LR-023,Password comparison is case-sensitive,EP: Exact case password - MD5 hash computed correctly,Juice Shop 运行于 http://localhost:3001；已加载默认种子数据（verified 2026-05-30）,"Input password as 'Password123'.
Retrieve the computed MD5 hash.
Verify that hash matches the precomputed MD5 for 'Password123'.",password: Password123,MD5 hash of 'Password123' is computed and matches the expected hash.,EP,High,20,CI_LR-023_field_password,Yes,KEPT,工具生成用例有效，仅标记审查通过,,,satisfied,种子账号/API 前置已验证
LR-023_DT_001,LR-023,Password comparison is case-sensitive,DT: Password provided - compute MD5 on exact string,Juice Shop 运行于 http://localhost:3001；已加载默认种子数据（verified 2026-05-30）,"Input password as 'TestCase1'.
Observe that MD5 hash is computed.",password: TestCase1,HTTP 401; MD5 comparison is case-sensitive,DT,High,20,CI_LR-023_condition_0,Yes,PATCHED,补全 test_data / 修正 expected_result 以匹配 Juice Shop 需求,,,satisfied,种子账号/API 前置已验证
tc-st-150c4561,LR-023,Password comparison is case-sensitive,State transition path 1 (ALL_TRANSITIONS),Juice Shop 运行于 http://localhost:3001；已加载默认种子数据（verified 2026-05-30）; System in state: Idle,"State: Idle
State: Idle",email=admin@juice-sh.op; password=Admin123,The MD5 hash is computed successfully and the returned value is a 32-character hexadecimal string matching the expected hash of the input password.,StateTransition,High,20,Idle--compute_hash/Compute MD5 hash on exact password string-->Idle,Yes,PATCHED,补全 test_data / 修正 expected_result 以匹配 Juice Shop 需求,,,satisfied,种子账号/API 前置已验证
